ID,HITL_Operator_ID,operator_hitl_eval,operator_hitl_reasoning,operator_hitl_link,HITL_Infra_Error,HITL_Infra_Error_Reasoning
1470.0,HITL-Operator-294,Success,Agent was able to find reservation times for Arden in NYC. ,https://www.loom.com/share/b864f98aad8141d19f04806932a4112c,False,
1478.0,HITL-Operator-295,Success,Agent was able to find the Arabic translation for the word proud. ,https://www.loom.com/share/339e91e6305a44f29d68b655e73b5c1d,False,
1491.0,HITL-Operator-296,Failure,Human timed agent out - it couldn't find the specs for the Galaxy s23 after multiple attempts.,https://www.loom.com/share/f49f2cba8ff1445593e097f66d89ff19,False,"The issue is related to the AI agent's navigation and information retrieval capability, as it timed out due to inability to find the required specs. This is not related to the infrastructure, such as login, proxy, captcha, or website loading issues."
1500.0,HITL-Operator-297,Success,Agent was able to find articles about â€œChinaâ€™s tech startupsâ€ and list the top five results with their publication dates. ,https://www.loom.com/share/d773069eaef84b4e91edf826feaa8a99,False,
1504.0,HITL-Operator-298,Success,"Agent was able to find the article and explained why ""The Flash"" was included in the article.",https://www.loom.com/share/f5c685cf4fb24487869db2635ca900fe,False,
1503.0,HITL-Operator-299,Failure,"Agent couldn't find a Marvel Rivals synopsis, so it tried to perform a Microsoft Bing search to retrieve it",https://www.loom.com/share/ff30845bcd4e4733829821ac939bcd19,False,"The issue described is related to the AI agent's ability to retrieve specific information (a synopsis of Marvel Rivals). It is not related to the infrastructure, such as login, proxy, captcha, or website loading problems. The problem lies in the agent's navigation and search capability, classifying it as a non-infrastructure issue."
1520.0,HITL-Operator-300,Failure,Agent was unable to find the most popular items and list the respective details.,https://www.loom.com/share/928f7200485743ba8841c34c20a732cc,False,"The issue is related to the AI agent's ability to find and list popular items, which falls under the category of navigation or information retrieval issues. This does not pertain to the infrastructure supporting the agent, such as login, proxy, or captcha problems."
1522.0,HITL-Operator-301,Failure,"Agent was unable to add the item to the cart, so this task was a failure.",https://www.loom.com/share/1a5013c1ea74468ab53dd84a0c687d1a,False,The issue is related to the AI agent's functionality in navigating the web application and performing a specific action (adding an item to a cart). This does not relate to browser infrastructure but rather the agent's logic or capability.
1525.0,HITL-Operator-302,Success,Agent found an article and returned a short summary as well. ,https://www.loom.com/share/a1f2648de3a64e6689376fa3e9c94e40,False,
1528.0,HITL-Operator-303,Success,Agent found the first five titles of the Smithsonian digital assets.,https://www.loom.com/share/e7b149504f994800a153b6778127d892,False,
1539.0,HITL-Operator-304,Success,Agent was able to comment and then edit and save its comment. Human had to log in and confirm both actions.,https://www.loom.com/share/f51eaff07d374cfe88c92d30b32f354f,False,
1546.0,HITL-Operator-305,Success,Agent was able to find relevant news related to Football and provide a summary. ,https://www.loom.com/share/bc43d8b0b5e04d0c90ce3f5c6ecb4162,False,
1545.0,HITL-Operator-306,Success,Agent found the most recent match recap and summarized it for the human.,https://www.loom.com/share/3e29ef3d27c244f2992495027c3d9e0a,False,
1551.0,HITL-Operator-307,Success,Agent successfully found the title of the most recent presentation.,https://www.loom.com/share/2ae5a74a414b4c83a24116390d8cd2c0,False,
1550.0,HITL-Operator-308,Success,Agent was able to list the titles and authors of the first five results. ,https://www.loom.com/share/f9a501a33b794e1cbe1c1d08836c7278,False,
1553.0,HITL-Operator-309,Success,Agent was able to find and return three presentations on sustainable energy.,https://www.loom.com/share/4b8f7349ae15476f87ba9cacbe266191,False,
1555.0,HITL-Operator-310,Success,Agent identified an article based on its mention in a 2024 most popular article.,https://www.loom.com/share/16d834dc65be4a5ba208fc6b0adb71d1,False,
1558.0,HITL-Operator-311,Bad Task,"You can create a tournament on Sofascore Editor, but not Sofascore.",https://www.loom.com/share/f81b2b9775274e87b1a7774eae0d1dec,False,
1566.0,HITL-Operator-312,Success,Agent identified the portion of the pitch that received the most attention by looking at the heat map.,https://www.loom.com/share/957445d3027046f985113c2b4c172bd5,False,
1586.0,HITL-Operator-313,Success,Agent successfully updated the bio to reflect the desired changes and saved it.,https://www.loom.com/share/3c42863cfeb84a19baf5ddda3145106b,False,
1573.0,HITL-Operator-314,Success,"Agent was able to post a relevant comment that it generated, as tasked.",https://www.loom.com/share/b3fc2bee55c4494f926830bc6e2b6184,False,
1591.0,HITL-Operator-315,Success,Agent created a playlist with the first episode from a tech podcast.,https://www.loom.com/share/1eba6becd83c4c6a82a50498836297be,False,
1605.0,HITL-Operator-316,Failure,Interface failed to respond multiple times when human took control of browser to log in.,https://www.loom.com/share/c1d4746287004768b7f5d725948eec1c,False,"The error indicates an issue with the interface responsiveness related to human interaction. This does not fall into typical infrastructure issues such as connectivity, login, or proxy problems. It seems more related to the agent's interaction design."
1601.0,HITL-Operator-317,Success,"Agent was able to create the playlist, add two tracks, and delete it successfully.",https://www.loom.com/share/ceff1d6bbe04424e8e72037cd23836cb,False,
1609.0,HITL-Operator-318,Success,Agent identified the 5 top trending playlists on Spotify.,https://www.loom.com/share/9463ed7671f94dae96979bbe0ab57b50,False,
1613.0,HITL-Operator-319,Bad Task,"Changing the audio setting to ""high"" requires an upgraded membership. ",https://www.loom.com/share/d62464a8adb24edda2a16b2068c1ade5,False,
1625.0,HITL-Operator-320,Success,Agent identified and summarized a recent philosophy article with a scientific twist as well. ,https://www.loom.com/share/d5ae495541a04de182591ad3395108eb,False,
1620.0,HITL-Operator-321,Bad Task,"Need to register as an author, which Halluminate does not currently have access to. ",https://www.loom.com/share/22d33858439e48159c964705820c0e7c,False,
1658.0,HITL-Operator-322,Failure,"After CAPTCHA popped up 4 times after human solved it again and again, it became clear there was a connection issue between the browser and the agent. ",https://www.loom.com/share/7f523d79a2784f38abb3f206068ff728,True,"The error involves CAPTCHAs, which are typically an infrastructure issue as they pertain to browser interactions and challenges encountered during navigation. The connection issue further indicates an infrastructure problem rather than a flaw within the agent's logic."
1662.0,HITL-Operator-323,Failure,CAPTCHA didn't process no matter how many times human solved it. ,https://www.loom.com/share/1a1b44bd39b94e089e36efaf322cde6f,True,"This is an infrastructure issue because it involves a CAPTCHA that the AI agent cannot process or bypass, which is directly related to the infrastructure the agent is interacting with rather than the functionality of the AI agent itself."
1659.0,HITL-Operator-324,Failure,"Agent got logged out of the community, which was inefficient to the process. ",https://www.loom.com/share/54b382fb753a48cb80fb05a449aa0dc9,False,"The issue described is related to the AI agent getting logged out, which suggests a problem with session management or state handling by the agent itself, rather than an infrastructure issue such as a login or proxy problem."
1635.0,HITL-Operator-325,Success,"Agent was able to log in and post an answer to a question about ""feature engineering techniques."" ",https://www.loom.com/share/b354f8d8c30841b88e7bf1b3e04591bd,False,
1644.0,HITL-Operator-326,Success,"Agent was able to post a guide titled ""How to use StackExchange effectively"" on the Meta site. ",https://www.loom.com/share/7924cdabcf1a4f7db85f18df5c2692af,False,
1671.0,HITL-Operator-327,Failure,"Agent was not able to find the question, so this task is a fail. ",https://www.loom.com/share/b387f365140e493db24bec79f2ba678d,False,"The issue is related to the AI agent's inability to find a specific question. This is a navigation or information retrieval issue specific to the agent's functionality. Therefore, it is not an infrastructure issue."
1642.0,HITL-Operator-328,Success,Agent was able to create the post successfully.,https://www.loom.com/share/f08de55d6b704fe492ee6be07a7fbdc0,False,
1669.0,HITL-Operator-329,Success,"Agent was able to post the question, and then revise and update the title of the question.",https://www.loom.com/share/b31278e480a141f4b47e90c7f0365648,False,
1661.0,HITL-Operator-330,Success,Agent was able to find three most recent community discussion topics.,https://www.loom.com/share/2e9ca161cabc4774b4a5c87ac1baf3f9,False,
1640.0,HITL-Operator-331,Success,"Agent posted a response to the question regarding ""SSD vs HDD performance"" and included data as well.",https://www.loom.com/share/f9cf7b71abbb42c1a5960b0b94f9d790,False,
1690.0,HITL-Operator-332,Success,"Agent was able to post about Node.js with the tag ""node"" and then go back to delete it.",https://www.loom.com/share/0630fede78604a67b23aa532140f599f,False,
1692.0,HITL-Operator-333,Success,Agent identified three tips from the Help Center page and returned them.,https://www.loom.com/share/24b1f5545eae49ebb97037cdbb3714e7,False,
1698.0,HITL-Operator-334,Failure,"Instead of creating a new post and editing that, it updated a previously posted post. ",https://www.loom.com/share/73a77d54805b4fc4b31d7142efdd71b1,False,"The issue is related to the AI agent's behavior in editing posts rather than infrastructure like logging in, website loading, or captchas."
1676.0,HITL-Operator-335,Failure,"Agent found the answer it needed to provide, and returned it instead of commenting on the question. ",https://www.loom.com/share/b9f2ab60e2974cf5a1aa9ce361ef728d,False,"The issue is related to the agent's actions (choosing to return an answer instead of commenting), not the infrastructure. It involves the decision-making process of the AI agent."
1705.0,HITL-Operator-336,Success,"Agent identified a list of Sebastian's ""loved"" gifts.",https://www.loom.com/share/fc1aa4d991b248c8a0b01aee44a47f77,False,
1704.0,HITL-Operator-337,Success,Agent was able to identify which villagers have summer birthdays successfully.,https://www.loom.com/share/283932ed63fa4d109ac36aeef9252be5,False,
1713.0,HITL-Operator-338,Success,Agent was able to filter by the sports industry and list the top three reports mentioned.,https://www.loom.com/share/e719c65807a8478fb145fa99d95af9fc,False,
1722.0,HITL-Operator-339,Failure,Agent was unable to find an update regarding a Steam Summer Sale. ,https://www.loom.com/share/375dfd089c1c47019d4ba57575e0fec2,False,"The error describes the AI agent's inability to find specific information regarding an update on a Steam Summer Sale. This is related to the information retrieval capabilities of the agent, not the infrastructure supporting it."
1723.0,HITL-Operator-340,Success,"Agent was able to browse the list of top sellers and provide a list of 50% or more discounted games. Human asked the agent to stop at some point because it was scrolling, which was both exhaustive but redundant.",https://www.loom.com/share/0de4035fa39743968e020b42cacb72c1,False,
1729.0,HITL-Operator-341,Failure,"Agent could not find a way to name the specific course ""Introduction to Economics.""",https://www.loom.com/share/75aff4cdb4ca42f5addc4ad03eeb420a,False,"The error described is related to the AI agent's ability to locate or identify a specific course. This indicates an issue with the agent's functionality, such as navigation or information retrieval, rather than with the infrastructure supporting it."
1732.0,HITL-Operator-342,Success,Agent was able to create the study list and generate a link to be able to share. ,https://www.loom.com/share/3308ade497a342e6986bcbb8ba3ab067,False,
1745.0,HITL-Operator-343,Success,"Agent updated the zip code to 10003 and found the time that it would take to ship, as well as the shipping cost.",https://www.loom.com/share/d9ff2cfb7d81444aaef88fbd4c3ed0da,False,
1750.0,HITL-Operator-344,Success,Agent found a relevant suggestion about power saving for a vehicle. ,https://www.loom.com/share/ef83fbea84c64c66b9731d0ebc17f1d0,False,
1765.0,HITL-Operator-345,Failure,"Agent found an article for a red carpet walk, not a royal ceremony, which would imply British Royalty/wedding.",https://www.loom.com/share/4ce3c3bd6502402cbf26bd11b387046d,False,"The error described pertains to the AI agent's ability to correctly identify and retrieve relevant information. It failed to distinguish between content about a 'red carpet walk' and a 'royal ceremony,' which is an issue with the AI agent's logic or understanding, rather than an infrastructure issue related to how the agent operates on the web."
1761.0,HITL-Operator-346,Success,"Agent was able to add an article from the front page, save it, and then delete it from the saved list. ",https://www.loom.com/share/e3484f134eb94f99a9a2f4cc1b81bb05,False,
1768.0,HITL-Operator-347,Failure,"Agent subscribed to a daily newsletter, and when prompted by human to change the preference to a weekly cadence, the agent tried to subscribe to a daily newsletter rather than changing the existing preference.",https://www.loom.com/share/3ccc1849528b471ba9a65bff0f6a302c,False,The error described is related to the agent's behavior in modifying its subscription preferences incorrectly. This indicates an issue with the agent's logic or decision-making process rather than an infrastructure problem.
1757.0,HITL-Operator-348,Failure,Agent was not able to find notifications on the website for technology articles. ,https://www.loom.com/share/0946897c25f144968b7b974028ca5387,False,"The issue is related to the agent's inability to locate specific content on the website, which indicates a problem with the AI agent's navigation or information retrieval capabilities, not an infrastructure issue."
1769.0,HITL-Operator-349,Success,Agent was able to find and provide a sufficient amount of key exam updates. ,https://www.loom.com/share/0bc6633f51ff4e56a57074db149ae4c0,False,
1774.0,HITL-Operator-350,Success,"Agent was able to find the ""Find Services"" section and provide all the registration details demanded.",https://www.loom.com/share/f31fa648c64b46d7b7f9f8ed533f845c,False,
1780.0,HITL-Operator-351,Success,Agent quickly identified the differences between each subscription model. ,https://www.loom.com/share/d55ef8b0e09d48d7aad9f92471d4c225,False,
1778.0,HITL-Operator-352,Success,Agent found the top three featured articles displayed and returned them.,https://www.loom.com/share/7dd0b06515b54d259bdf2dadea67bf90,False,
1784.0,HITL-Operator-353,Success,Agent successfully found and returned the top five featured articles on game reviews.,https://www.loom.com/share/3379ab3407fd4143a66ebcd5dbad0692,False,
1785.0,HITL-Operator-354,Failure,"Agent found an article and summarized the synopsis, but failed to summarize the argument. ",https://www.loom.com/share/70ea4cce4329430e8dc54bfb6eba3989,False,"The issue described is related to the AI agent's capability to correctly analyze and summarize the content. This is a functionality problem with the agent itself, not an infrastructure issue."
1792.0,HITL-Operator-355,Success,Agent found the first article related to COVID-19.,https://www.loom.com/share/9ab426bd8e894276a180e4c2eaf6e66c,False,
1798.0,HITL-Operator-356,Success,Agent found the top 5 trending movies on the website.,https://www.loom.com/share/06ffe60589af45858c49584180b81caf,False,
1813.0,HITL-Operator-357,Success,"Agent found a tutorial recipe with Ree Drummonds signature cookies, and provided a link as well.",https://www.loom.com/share/b4360731f56a44d6935f8e751ffdea1f,False,
1801.0,HITL-Operator-358,Success,Agent was able to find a recipe in the comfort food section and save it. ,https://www.loom.com/share/8a5f9a820e34432486b570749858a4a6,False,
1816.0,HITL-Operator-359,Success,"Agent found the first 5 synonyms for ""rapid.""",https://www.loom.com/share/239c8aa13b4d4b3f8a76bc35a0cd5356,False,
1819.0,HITL-Operator-360,Success,"Agent found the first five articles that came up when it searched for ""DIY Kitchen Backsplash Ideas.""",https://www.loom.com/share/0dcc2ec986ac44318a7a29dca2b4ce22,False,
1828.0,HITL-Operator-361,Success,Agent found and returned the first three articles on the homepage. ,https://www.loom.com/share/440863d345144980b3edaa6eee82fabc,False,
1829.0,HITL-Operator-362,Success,Agent was able to find 3 threads and summarize them as tasked. ,https://www.loom.com/share/d92d6951a60e4a13a4d5b4173809702c,False,
1833.0,HITL-Operator-363,Success,"Agent was able to find 2 family friendly events in Orlando, FL",https://www.loom.com/share/bac1f4fc50c74aabb1a268b2edbd71cc,False,
1832.0,HITL-Operator-364,Success,"Agent was technically correct in the sense that no tickets are available for NFL games because as of April 29th, 2025, the NFL schedule has not yet been released.",https://www.loom.com/share/eada76b1d70f49cd931efb28b4860e6f,False,
1836.0,HITL-Operator-365,Failure,"Agent provided the like count, but not the view count. ",https://www.loom.com/share/4a06f6f93707479790ed02c4428fd1f9,False,"This issue is related to the AI agent's ability to retrieve specific information (view count) from a webpage. It is not related to the infrastructure running the agent, such as loading or accessing a website. Hence, it is classified as a non-infrastructure issue."
1843.0,HITL-Operator-366,Success,Agent was able to find the first article and provide a 2-3 sentence summary effectively.,https://www.loom.com/share/5a21fd851cdd4eb98aaf4bb32f4d13ea,False,
1848.0,HITL-Operator-367,Success,Agent was able to find pricing details and return them for Time and Date. ,https://www.loom.com/share/e91057e3b75b4338bee8d57ed1e60601,False,
1857.0,HITL-Operator-368,Bad Task,This task is dependent on a previous task being completed.,https://www.loom.com/share/403a65ce76714bf9a7b062491de46f84,False,
1860.0,HITL-Operator-369,Success,"Agent was able to return the title and summary of the top article when searching for â€œhealthy breakfast recipes.""",https://www.loom.com/share/dbf78b03714a46d4aae535a50265884e,False,
1858.0,HITL-Operator-370,Success,Agent was able to scroll until it couldn't anymore and recorded 120 different articles. ,https://www.loom.com/share/c636b561c7cd4dd6946ac1b6bb171494,False,
1853.0,HITL-Operator-371,Failure,"Agent was able to save the recipe, but couldn't access the bookmarks folder and din't provide a note as to why it liked the recipe. ",https://www.loom.com/share/17ce764a1d834ed7859ed6b9c9d3e06f,False,"The issue described relates to the AI agent's inability to access a bookmarks folder and provide a note, which is related to the agent's capability and logic rather than any infrastructure problems. Therefore, it is classified as a non-infrastructure issue."
1861.0,HITL-Operator-372,Success,Agent was able to find the schedule and return the time of today's episode. ,https://www.loom.com/share/265886ec04224d089e729129f9d21886,False,
1868.0,HITL-Operator-373,Failure,Agent was unable to locate the guide with a downloadable pdf. ,https://www.loom.com/share/c77b6f9390c34dffa93e47e71695e8cb,False,"The issue described involves the agent's inability to locate specific content (a guide with a downloadable PDF) on a website. This is related to the agent's navigation or searching capabilities rather than an infrastructure problem like loading issues, login issues, or blocking by a website."
1873.0,HITL-Operator-374,Success,Agent was able to filter for reviews and listed the top review headline. ,https://www.loom.com/share/f3719ce945f44dcd98290a56bc3c3b41,False,
1883.0,HITL-Operator-375,Success,Agent was able to navigate to the homepage and list the top five featured travel industry news headlines.,https://www.loom.com/share/1dadc99a54c14323893106588b3e13a0,False,
1885.0,HITL-Operator-376,Failure,Agent wasn't able to find any webinars related to travel technology. ,https://www.loom.com/share/4d2604581b404397a7370915155ba012,False,"The issue described is related to the agent's ability to find specific information on the internet, which is an information retrieval issue. It is not related to the underlying infrastructure such as login, proxy, captcha, or website loading issues."
1888.0,HITL-Operator-377,Success,Agent was able to browse the homepage and list the top 5 trending properties. ,https://www.loom.com/share/6cca7c0d64554d4eb4168cd7ead7097b,False,
1890.0,HITL-Operator-378,Success,"Agent was able to search for tours available in Rome tomorrow and list the top three tours sorted by ""Top Rated"".",https://www.loom.com/share/ccb756ffbdf54e02a8de3c71468f729b,False,
1892.0,HITL-Operator-379,Success,"Agent was able to filter by the necessary constraints, locate the highest rated hotel, and provide multiple anecdotes of the hotel's service. ",https://www.loom.com/share/c4ac4e017b24491a8032bae7c60096bb,False,
1897.0,HITL-Operator-380,Success,"Agent filtered by HR & Recruiting located in ""London"", then listed the review summaries for the top three highestâ€‘rated companies.",https://www.loom.com/share/9de36385ab79453ab0f274add78374b7,False,
1911.0,HITL-Operator-381,Success,"Agent was able to create a bit donation message, and then update it to include a name, which human provided. Name was able to be different than account name. ",https://www.loom.com/share/855c3569496444eb81a9de7f67a060e5,False,
1914.0,HITL-Operator-382,Success,Agent was able to screen the Admissions section and extract the key deadline dates for Fall 2025 undergraduate applications.,https://www.loom.com/share/09ad9976c8af4334bd50bd1a7554f53e,False,
1915.0,HITL-Operator-383,Success,Agent was able to identify hours and contact information at the UC Davis main library.,https://www.loom.com/share/84bfda4fbd9145a5a2db75f6bf1ec4c0,False,
1917.0,HITL-Operator-384,Success,Agent was able to extract the main eligibility criteria and deadlines for applying for aid. ,https://www.loom.com/share/30d15d920aa34ec18ba6103fa5927a50,False,
1924.0,HITL-Operator-385,Success,Agent was able to identify all of the sports teams at UCLA. ,https://www.loom.com/share/d3271a21051f49518bf9c23f3fbc487d,False,
1930.0,HITL-Operator-386,Success,Agent looked at UF research computing facilities and noted two primary services offered.,https://www.loom.com/share/f45244fe07934c09975f4556b58405cf,False,
1931.0,HITL-Operator-387,Success,Agent was able to scan the Computer Science department and identify research domains. ,https://www.loom.com/share/81c1d23815894d9cab853bdb774ee881,False,
1938.0,HITL-Operator-388,Failure,Agent was unable to access the site on the browser. ,https://www.loom.com/share/480a5947a89146ac95a74bc6e8dce1f0,True,"The issue described is related to the accessibility of the website, which is a general website loading problem. This is classified as an infrastructure issue because it pertains to the browser infrastructure and the agent's inability to load the website effectively."
1939.0,HITL-Operator-389,Success,Agent was able to identify the top headlines on the front page. ,https://www.loom.com/share/36139c1a70bb4846af8046461601d115,False,
1942.0,HITL-Operator-390,Success,"Agent listed two online courses or learning platforms mentioned on the ""Michigan Online"" page.",https://www.loom.com/share/79a08f6474f84015bdae6b111bf55eb5,False,
1951.0,HITL-Operator-391,Failure,"Agent was unable to find the BlockTech shirt, so this was a failure. ",https://www.loom.com/share/6d3a572b9c074f6e9001140f575a245c,False,"The issue is related to the AI agent's ability to locate a specific item ('BlockTech shirt'), which indicates a navigation or information retrieval problem inherent to the agent's function, not an underlying infrastructure issue. The infrastructure appears to be functioning since the task involves finding an element rather than accessing the website or dealing with login, proxy, captcha, or website loading issues."
1966.0,HITL-Operator-392,Success,Agent was able to find information on interdisciplinary research centers and list two names provided.,https://www.loom.com/share/2b1df8ae1dc54e71a9f3c61f4b15f364,False,
1968.0,HITL-Operator-393,Success,"Agent was able to find the definition of ""woke"" and listed ""cultural marxism"" as keywords. ",https://www.loom.com/share/88c744c8639b4ee4b9ac54c779dd9a73,False,
1969.0,HITL-Operator-394,Success,"Agent was able to find the definition for ""stan,"" and briefly summarized the differences for the top two definitions. ",https://www.loom.com/share/e0336d8b997743f1b0ca0528cbbf8ad9,False,
1974.0,HITL-Operator-395,Success,"Agent found the pdf, downloaded it, confirmed it was in pdf form, and offered a link to access the pdf. ",https://www.loom.com/share/3b6f8a412b2b42098883c826c3b49c82,False,
