ID,HITL_Operator_ID,operator_hitl_eval,operator_hitl_reasoning,operator_hitl_link,HITL_Infra_Error,HITL_Infra_Error_Reasoning
885.0,HITL-Operator-188,Success,Agent successfully updated the organic bananas bunches from 6 to 10 ,https://www.loom.com/share/b57cc255ea1149bf82799e03edef7f62,False,
890.0,HITL-Operator-189,Success,Agent successfully found the 5 projects tagged with woodworking,https://www.loom.com/share/dcdb3ec864ed4f1ba70f723901cc59f2,False,
895.0,HITL-Operator-190,Success,Agent successfully found the article realted to economic damage and summed it up in 3 key indicators,https://www.loom.com/share/d825089ef52d45719057803977e9a1da,False,
897.0,HITL-Operator-191,Success,Agent successfully found the payment options for Direct Pay,https://www.loom.com/share/5e8a28ddfa734b39a60d3ccf29da7384,False,
905.0,HITL-Operator-192,Failure,"Agent failed to access the website due to an error ""Site Unavailable""",https://www.loom.com/share/0f1f50c3b2844eba879d47e824b57ea4,True,"The error 'Site Unavailable' indicates a general website loading issue, which is related to the infrastructure that the AI agent relies on to access content. Since the problem arises from the website's availability and not from the AI agent's logic or functionality, it qualifies as an infrastructure issue."
916.0,HITL-Operator-193,Success,Agent successfully found the upcoming exams from three different sections,https://www.loom.com/share/487078d29f4e45ffb969cc786ded1b3f,False,
913.0,HITL-Operator-194,Failure,Agent failed to return the number of papers it found as it was trying to search for more papers and it kept going even after I asked it to stop,https://www.loom.com/share/1b61261b0127485ab6ed17075e156b30,False,"The error pertains to the AI agent's logic and behavior in handling search queries and user commands. It is not related to infrastructure issues like login, proxy, captcha, or website loading problems."
919.0,HITL-Operator-195,Failure,Agent failed to find the article and so it was not able to find the keywords as well,https://www.loom.com/share/7345b55a14ce440a95169ef78b0c4949,False,"The issue described is related to information retrieval, where the AI agent failed to find the article and its keywords. This is a problem with the agent's logic or algorithm, not an infrastructure issue such as loading or accessibility of the website."
927.0,HITL-Operator-196,Failure,Agent failed to access the information of operating hours of the medical clinic,https://www.loom.com/share/8b463ace45b0459fa85e2503b70f7f87,False,"The error pertains to the AI agent's failure to retrieve specific information (operating hours of a medical clinic). This is likely related to how the agent is navigating the website or interpreting the data, which classifies it as a non-infrastructure issue. It does not involve login, proxy, captcha, or general website loading issues."
945.0,HITL-Operator-197,Success,Agent successfully found the number of languages offered,https://www.loom.com/share/78714670fd4842a1907cbb69ebc3eb02,False,
948.0,HITL-Operator-198,Failure,Agent failed find an option to update the monthly learning goal in the available sections. The account seems to have no progress or goals set yet.,https://www.loom.com/share/197c4e4f2f694983adf7c61031880e2e,False,"The error pertains to the AI agent's inability to find an option to update goals, indicating a navigation or information retrieval issue related to the agent's logic and behavior. It does not relate to infrastructure such as login or access issues."
943.0,HITL-Operator-199,Failure,Agent failed to find the first five courses related to algebra as it only returned the top 4,https://www.loom.com/share/363fc6ee19dd4777b443dd6b681b4fe6,False,"The issue described is related to the AI agent's information retrieval capabilities. It failed to find the required number of courses, which indicates a potential problem with the agent's logic or search criteria, not with the infrastructure running the agent."
953.0,HITL-Operator-200,Failure,Agent stopped abruptly with no reason mentioned and even after retrying it was not able to contiue working on the task,https://www.loom.com/share/481db56ebd554f77b578ec10ccaeec57,False,"The issue described appears to be a problem with the AI agent itself, as it is stopping abruptly without a clear reason and cannot continue even after retries. This suggests a potential bug or logic issue in the agent's behavior rather than an infrastructure-related problem like login, proxy, or captcha issues."
958.0,HITL-Operator-201,Success,Agent successfully added the items to a shopping wishlist,https://www.loom.com/share/6766580910f648259831b5654e147bfc,False,
960.0,HITL-Operator-202,Success,Agent successfully added an item then removed it as suggested,https://www.loom.com/share/51653ffc4d7d4c05ad87ad3bc35cb3ed,False,
965.0,HITL-Operator-203,Bad Task,Agent was not able to find LED TV as it was not available on the website itself,https://www.loom.com/share/1e8a7aabdad74f198ee1a3e3353604ba,False,
977.0,HITL-Operator-204,Failure,"Agent failed to access the website due to an error ""Site Unavailable""",https://www.loom.com/share/80cae66f97e1433e8e020c9fbb9eaf0d,True,"The error 'Site Unavailable' indicates a website loading issue, which is related to the infrastructure running the agent, rather than the agent itself. Therefore, it is classified as an infrastructure issue."
980.0,HITL-Operator-205,Failure,"Agent failed to access the website due to an error ""Site Unavailable""",https://www.loom.com/share/f3cdc6edfd114710acb99454d23cfc28,True,"The error 'Site Unavailable' indicates a general website loading issue, which is classified as an infrastructure issue. This is because it pertains to the website's availability rather than the autonomous agent's ability to perform tasks."
981.0,HITL-Operator-206,Failure,"Agent failed to access the website due to an error ""Site Unavailable""",https://www.loom.com/share/bdd2650c636b47e8af9d0539034be088,True,"The issue described is related to the inability of the agent to access a website due to it being unavailable. This falls under general website loading issues, which is considered an infrastructure issue."
992.0,HITL-Operator-207,Success,Agent successfully found the film and posted a review as suggested,https://www.loom.com/share/673c45ce024443ac95dcfedf73cf1b35,False,
995.0,HITL-Operator-208,Success,Agent successfully added 3 films to the profile in Favorite section,https://www.loom.com/share/0d9baa35e54d463b86f1dff9c0af03d2,False,
1021.0,HITL-Operator-209,Success,Agent successfully composed a post on linkedIn,https://www.loom.com/share/9d13551e90e446e19796ea70d628dc53,False,
1017.0,HITL-Operator-210,Success,Agent was successfully able to post a comment on a google's recent post,https://www.loom.com/share/54cb8853a8ab4ebabe518b30458261b2,False,
1033.0,HITL-Operator-211,Success,Agent successfully added a new post and later edited it to update the hashtags,https://www.loom.com/share/3936ddd915434ccaad7076c4b701fc80,False,
1016.0,HITL-Operator-212,Bad Task,Agent did try to find the options for recommending but it stopped at a stage where it needs to connect with someone to recommend,https://www.loom.com/share/1a77eab015ec471b994ed38ac3c680bd,False,
1015.0,HITL-Operator-213,Success,Agent successfully added the experience as suggested,https://www.loom.com/share/333a5756433d45339ad0009a6285ac91,False,
1043.0,HITL-Operator-214,Success,Agent successfully added three friends and removed one at the end,https://www.loom.com/share/a877a6d12fac42f79f650e904f893d64,False,
1041.0,HITL-Operator-215,Success,Agent successfully added a temporary journal and then deleted it,https://www.loom.com/share/bb03606157d4498599208795ab21c735,False,
1050.0,HITL-Operator-216,Failure,Agent failed to update the timings of the post it already posted some time ago,https://www.loom.com/share/6a0dd71a149348c8832890b4232e13c8,False,"The issue is related to the AI agent's ability to interact with a webpage to update content it previously posted. This is a functionality or logic-related problem in the agent itself, not an infrastructure issue."
1052.0,HITL-Operator-217,Success,Agent successfully found the information as requested,https://www.loom.com/share/26e467a2863b4abb8525e59240a6777d,False,
1053.0,HITL-Operator-218,Success,Agent successfully found the information as requested,https://www.loom.com/share/1ccc5308df4849249c6c76c3b77e6922,False,
1057.0,HITL-Operator-219,Success,Agent successfully found a manuscript and was able to download it as well,https://www.loom.com/share/fa15a26c1aea4e3b9a47bcceef48098d,False,
1063.0,HITL-Operator-220,Success,Agent successfully found the title of top three articles as requested,https://www.loom.com/share/1fcb4e5d27c64eb5963ac45decf4099a,False,
1077.0,HITL-Operator-221,Failure,"Agent failed to access the website due to an error ""Site Unavailable""",https://www.loom.com/share/d09c0085a8a5403f82db07e88435cc0c,True,"The error 'Site Unavailable' indicates a general website loading issue, which is related to the browser infrastructure running the agent. The AI agent is unable to access content due to the website's availability, not because of any issues with the agent's functionality."
,HITL-Operator-222,Failure,"Agent failed to access the website due to an error ""Site Unavailable""",https://www.loom.com/share/55d0c5c3e75b4f489addc0c73ce8e05c,False,
,HITL-Operator-223,Failure,"Agent failed to access the website due to an error ""Site Unavailable""",https://www.loom.com/share/1039d961d03d43e09c94d0e377482b65,False,
,HITL-Operator-224,Failure,"Agent failed to access the website due to an error ""Site Unavailable""",https://www.loom.com/share/33e0321eb3c1420f96aae2755106961e,False,
1084.0,HITL-Operator-225,Success,Agent successfully found the information about a dress with its price and reviews,https://www.loom.com/share/4a906832ef2f4e09b4f046f3998d2e45,False,
1087.0,HITL-Operator-226,Failure,"Agent failed to access the website due to an error ""No Internet""",https://www.loom.com/share/1ff0ecb867a849cd953149c08f34b25b,True,"The error 'No Internet' indicates a problem with connectivity, which is related to the infrastructure required for the agent to access the web, rather than an issue with the AI agent itself. This falls under general infrastructure issues related to website loading or access."
1094.0,HITL-Operator-227,Failure,"Agent failed to access the website due to an error ""No Internet""",https://www.loom.com/share/3400ff8530194203ab619ee969eea485,True,"The error 'No Internet' indicates a problem with the network connectivity or accessing the website's infrastructure, which directly affects the agent's ability to perform its task. This is considered an infrastructure issue because it relates to the inability to reach the necessary web resources, not the functionality of the AI agent itself."
1096.0,HITL-Operator-228,Failure,"Agent failed to access the website due to an error ""No Internet""",https://www.loom.com/share/ea3fb3918a36463b851c5cf6148e7415,True,"The error relates to a lack of internet connectivity, which is an infrastructure problem affecting the agent's ability to access the website. This is not related to the agent's own functioning or decision-making processes."
1107.0,HITL-Operator-229,Failure,"Agent failed to access the website due to an error ""No Internet""",https://www.loom.com/share/8d039cf44a2a4c6d975b4d44794b1373,True,"The error 'No Internet' indicates a connectivity issue affecting the agent's ability to access the website. This is considered an infrastructure issue as it pertains to the underlying internet connectivity necessary for the agent to function, rather than an issue with the agent itself."
1106.0,HITL-Operator-230,Success,Agent successfully found the info as requested,https://www.loom.com/share/397201cdce494fa98c258f5e15c387a0,False,
1109.0,HITL-Operator-231,Failure,"Agent failed to access the website due to an error ""Site Unavailable""",https://www.loom.com/share/38f68cd13611440db5c8e9b282d96216,True,"The error 'Site Unavailable' indicates a website loading issue, which falls under infrastructure issues as the agent is unable to access the website at all."
1110.0,HITL-Operator-232,Failure,"Agent failed to access the website due to an error ""Site Unavailable""",https://www.loom.com/share/502ec5f7ab164a5682f94570bc4e4b76,True,"The error 'Site Unavailable' indicates that the website could not be accessed, which is an infrastructure issue related to the website loading or availability, not the AI agent itself."
1126.0,HITL-Operator-233,Success,Agent successfully found the top 5 articles as requested,https://www.loom.com/share/9e4bb4d0353f4ce0956dbd9dcdec3e1d,False,
1134.0,HITL-Operator-234,Success,Agent successfully found the average pricing of the used smartphones as requested,https://www.loom.com/share/eaa30d4d25cd43b78c8dccf1bf5d3c41,False,
1147.0,HITL-Operator-235,Success,Agent successfully found the article,https://www.loom.com/share/0eff7fb79e12408ca68077595a3b6a83,False,
1144.0,HITL-Operator-236,Success,Agent successfully found the information from an article as requested,https://www.loom.com/share/a8707a343aec4115b21f2c186991e234,False,
1154.0,HITL-Operator-237,Success,Agent successfully found the ecomonic department and from that found the latest article as requested,https://www.loom.com/share/d22558965f504499abe058d817cabb31,False,
1166.0,HITL-Operator-238,Success,Agent successfully found the information in virtual urgent care steps,https://www.loom.com/share/05b48a9158b7482994f02beb68013156,False,
1198.0,HITL-Operator-239,Success,Agent successfully found the top-5 articles from the business section,https://www.loom.com/share/9ff022ceaa954e5d93e273aa8ec480d5,False,
1197.0,HITL-Operator-240,Failure,"Agent failed to find news from Rajasthan directly from the website so it tried to search it on another domain, which is not allowed",https://www.loom.com/share/d079531976a440538f97f2b549212a15,False,"The error describes the agent's failure to find information on a website and its subsequent action to search on another domain, which violates allowed behavior. This is a navigation or information retrieval issue related to the AI agent's logic and decision-making, not an infrastructure problem."
1207.0,HITL-Operator-241,Failure,"Agent was not able to find the seller account directly from the webpage so it tried to search it via another domain, and it is not allowed",https://www.loom.com/share/fe8481531f044f89941d43d667c68b85,False,"The issue is related to the AI agent's navigation and search logic, as it couldn't find the seller account on the webpage and incorrectly attempted to search via another domain. This is not related to browser infrastructure."
1210.0,HITL-Operator-242,Success,Agent successfully found the top 3 ssd as requested,https://www.loom.com/share/6ae46e333a1643629f0e395ffba48f80,False,
1212.0,HITL-Operator-243,Success,Agent successfully found the information on premium membership,https://www.loom.com/share/7edb7cff50b143f4b2b62d75bf8ca029,False,
1224.0,HITL-Operator-244,Success,Agent successfully found the recommendation on 3 restaurant from an article in Food & Dining section,https://www.loom.com/share/bd51787434e645919c64a87e7b0ff293,False,
1230.0,HITL-Operator-245,Failure,Agent failed to login even after multiple help from my side,https://www.loom.com/share/04d3dfff320640639a3f67370e1dcd06,True,"The error refers to a login issue, which is considered an infrastructure issue. The agent's inability to login suggests a problem with the infrastructure or process involved in accessing the website, not the agent's functionality itself."
1231.0,HITL-Operator-246,Failure,Agent failed to login even after multiple help from my side,https://www.loom.com/share/9516c4e3ed17496f9d7bfe093a57aa7a,True,"The error is an infrastructure issue because it involves the agent being unable to log in, which is related to browser infrastructure rather than the agent's internal processing."
1233.0,HITL-Operator-247,Success,Agent successfully found the suit with its price and available sizes,https://www.loom.com/share/ae1fa80395ce4e5e873bd986f2f81d75,False,
1236.0,HITL-Operator-248,Success,Agent successfully found the information on handbags from the mentioned section,https://www.loom.com/share/f931815495a14faeb5dc6ae247b43551,False,
1240.0,HITL-Operator-249,Success,Agent successfully found all the parks mentioned in the given location,https://www.loom.com/share/eec83e432f2a46d1aec4627e9abae55b,False,
1241.0,HITL-Operator-250,Success,Agent successfully found the contact information for renewal of a license,https://www.loom.com/share/8638e6a0e10449f4a04394c30c02bf85,False,
1246.0,HITL-Operator-251,Success,Agent successfully found the information on programs in NYC as requested,https://www.loom.com/share/11e5ea1be38d48ae925eb31334cc8e0e,False,
1245.0,HITL-Operator-252,Success,Agent successfully found two questions on waste management as requested,https://www.loom.com/share/c06b7df265ba404a9b12039c6ad268c4,False,
1259.0,HITL-Operator-253,Success,Agent successfully wrote a comment on a recent article and edited it later,https://www.loom.com/share/6f00c56e88c64ad292f1dbe394cb8ff1,False,
1257.0,HITL-Operator-254,Success,Agent successfully found the article from buisness section,https://www.loom.com/share/5435771d5b224c90ae240a622bcd8847,False,
1254.0,HITL-Operator-255,Success,Agent successfully found the information on a recent article,https://www.loom.com/share/f5fa0ae2e8f249648084269594efc66a,False,
1270.0,HITL-Operator-256,Success,Agent successfully filtered words and gave the top 10 as requested,https://www.loom.com/share/c8f96832553f4a2db45e3e8ef34d5396,False,
1282.0,HITL-Operator-257,Success,Agent successfully gave the top 5 athletes from the website,https://www.loom.com/share/0528b9f754ce4a2786dd9adddf17e16a,False,
1284.0,HITL-Operator-258,Bad Task,There is no option to update that specific alert so AI was not able to find it,https://www.loom.com/share/01a4ba3edb8a42659999dce17985ae4c,False,
1299.0,HITL-Operator-259,Success,Agent successfully found the reviews on a particular restaurant as requested,https://www.loom.com/share/956faa64f6994dcc8b5df2688fd5a759,False,
1297.0,HITL-Operator-260,Bad Task,Agent was not able to find the exact restaurant as there is none that exist and even if it found one there were no hours of operation mentioned,https://www.loom.com/share/3e23f3987a7245578b691f83df6e0df4,False,
1293.0,HITL-Operator-261,Bad Task,"Agent failed to book the table with a message saying ""The Cheesecake Factory is not available for reservations on OpenTable""",https://www.loom.com/share/062f20f68a96426897c6055cfb7b2482,False,
1307.0,HITL-Operator-262,Success,Agent successfully found the environmental quality page and contact details mentioned in there,https://www.loom.com/share/485c6f09a91a41ba97be3f5c604c6b49,False,
1315.0,HITL-Operator-263,Success,Agent successfully subscribed to the newsletter by providing the email as requested,https://www.loom.com/share/f21bdd5f4c9a4cb18b44d36eb4d5d2b0,False,
1318.0,HITL-Operator-264,Bad Task,Agent was not able to set notification preferences as there is no option available on the website,https://www.loom.com/share/8cde54e2dc3e4f65b1a2179cabea43b7,False,
1328.0,HITL-Operator-265,Bad Task,Agent was not able to find any comments written by the user as there were none posted and the task also didn't mention where to exactly look for,https://www.loom.com/share/58b3c841d201419eb63dca75a4e3a14b,False,
1321.0,HITL-Operator-266,Success,Agent successfully wrote a comment on a recent article and deleted it later,https://www.loom.com/share/a96709ac8a8d46dfa2303c374550afbd,False,
1324.0,HITL-Operator-267,Success,Agent successfully found the top-3 articles on hardware reviews,https://www.loom.com/share/14cc95ec8a104b8c9555a3d97821a795,False,
1360.0,HITL-Operator-268,Success,Agent successfully found the top-5 results and information related to it,https://www.loom.com/share/db0b0eba3cac4798a0c22d4908fa1bff,False,
1356.0,HITL-Operator-269,Success,Agent successfully found the top-3 trending videos along with their download sizes,https://www.loom.com/share/a6484b32718840698ee376f4bfb5e533,False,
1359.0,HITL-Operator-270,Success,Agent successfully found the information on top-5 results as requested,https://www.loom.com/share/0f66394869894683ac3d621d3984a523,False,
1364.0,HITL-Operator-271,Failure,"Agent couldn't find the newsletter subscription page, so it tried to perform a Microsoft Bing search to retrieve it",https://www.loom.com/share/f8b00cbdbd3c4580a29f41396a052ea9,False,"The problem described is related to the agent's ability to locate a specific page, which falls under navigation issues. It is not related to the underlying infrastructure such as network, login, proxy, or loading capabilities, but rather to the logic or navigation of the agent itself."
1365.0,HITL-Operator-272,Success,"Agent initiated a conversation with a helper bot, thus submitting a formal inquiry. ",https://www.loom.com/share/830fb1cc90c540498792a41261950f2b,False,
1369.0,HITL-Operator-273,Success,"Agent was able to browse the homepage and locate the main article release, returning its headline and summary. ",https://www.loom.com/share/b647d674a63a4b9691b7dafb47be3997,False,
1377.0,HITL-Operator-274,Success,Agent found three game titles from a recommended games list.,https://www.loom.com/share/7ce851a7c0df4dc6bfa0dac0dc116ea6,False,
1392.0,HITL-Operator-275,Success,Agent was able to find and return two locations for Purdue students to study abroad.,https://www.loom.com/share/6be02622f0414fa6a7570531c78e2159,False,
1395.0,HITL-Operator-276,Success,"Agent was able to navigate to the FAQ section on creating your questions, and summarize the first three steps listed.",https://www.loom.com/share/3c5f6915ba0d4746bda46ddade3b72c5,False,
1409.0,HITL-Operator-277,Failure,"After logging in, the login attempt didn't process so agent was unable to move forward.",https://www.loom.com/share/a60f4937445f4d63bf2e1a70bb74f0aa,False,"The issue described occurs after the login process, indicating that the error lies not in the infrastructure handling the login but potentially in the agent's logic or handling of post-login activities. Therefore, it is not classified as an infrastructure issue."
1400.0,HITL-Operator-278,Success,Agent was able to create a shareable link and embed it within its generated message.,https://www.loom.com/share/264fd2c005bd407db10fe4f428c592b0,False,
1407.0,HITL-Operator-279,Failure,Agent timed out - human determined that 10 minutes was inefficient for the task.,https://www.loom.com/share/d33ff5659aae427a803e2bb5a248f7e4,False,"The error describes a timeout issue related to task completion time, which indicates a limitation in the AI agent's task process and efficiency rather than an infrastructure issue."
1413.0,HITL-Operator-280,Success,Agent was able to visit the Shopping section and record the authorâ€™s name and publication date for the leading article. ,https://www.loom.com/share/d745ea240f334e7c959f33d576395048,False,
1416.0,HITL-Operator-281,Failure,Agent timed out - human determined that 10 minutes was inefficient for the task.,https://www.loom.com/share/d7350e00b4cc49b49fc29b885a8e9464,False,The error described is related to the AI agent's inability to complete the task within the allotted time due to its programming or task complexity. This is not an infrastructure issue but rather a problem with how the agent is designed to handle the task.
1417.0,HITL-Operator-282,Success,Agent was able to input criteria and find 5 agents as well as their contact information as tasked. ,https://www.loom.com/share/1bd7b6ee39484efe808b22b3ccc0f4b0,False,
1428.0,HITL-Operator-283,Success,Agent was able to find 20 product titles for a search of floral pattern.,https://www.loom.com/share/51324eb381cf40c99b0ab32f104cad5f,False,
1438.0,HITL-Operator-284,Success,Agent was able to find the three highest rated hiking boots and return them. ,https://www.loom.com/share/00e1e801f97e4782b1bd8b1492e193ca,False,
1448.0,HITL-Operator-285,Success,Agent was able to find the three highest rated Italian restaurants in NYC. ,https://www.loom.com/share/21fa843105bc49e29b5ff388ee70672d,False,
1469.0,HITL-Operator-286,Success,Agent was able to find available reservation times for French restaurants in New York City tonight.,https://www.loom.com/share/a985dbf577804361b0b32f0d4f0b3641,False,
1455.0,HITL-Operator-287,Bad Task,"Need to pay money to reserve a table, but in theory this works.",https://www.loom.com/share/f82d115ce5f543dfbda10aadad8cfe59,False,
1472.0,HITL-Operator-288,Failure,"Agent was unable to alter the reservation directly, but attempted to cancel the reservation and then create a new one. ",https://www.loom.com/share/55ce718465024a4d98555ba006043ffe,False,"This issue is related to the AI agent's logic or functionality, as it attempted to handle a reservation by canceling and creating a new one. It doesn't relate to underlying infrastructure like connection, login, or website loading issues."
1476.0,HITL-Operator-289,Bad Task,"Agent would have been able to complete this task, but the reservation would have charged $25 for a missed reservation, which nobody would've attended.",https://www.loom.com/share/5840d8ebed6d4b66a3bfee336d0542ca,False,
1464.0,HITL-Operator-290,Success,Agent was successfully able to add all of the restaurants to a saved list. ,https://www.loom.com/share/3ab447ddcff04c90878fff8b6d605f25,False,
1466.0,HITL-Operator-291,Success,Agent was able to add the restaurant to the hit list and then remove it. ,https://www.loom.com/share/faa8b6702bd445fb9cd9c7e2d8ba9640,False,
1456.0,HITL-Operator-292,Success,Agent was able to reserve an 8 person table at the desired restaurant. ,https://www.loom.com/share/cee0abe0c39a4c50b47693ffd5775ac5,False,
1468.0,HITL-Operator-293,Success,Agent was able to identify that Carbone has a 4 $ rating.,https://www.loom.com/share/a1d96a35c6804f3999e66e54cd8956c0,False,
