ID,HITL_Operator_ID,operator_hitl_eval,operator_hitl_reasoning,operator_hitl_link,HITL_Infra_Error,HITL_Infra_Error_Reasoning
425.0,HITL-Operator-89,Success,"Agent was able to identify the resources section, although it took the agent several tries to identify where on the page it was. It was also able to distinguish between news articles and books.",https://www.loom.com/share/a0912cb6c0b746158fb8ad6011f78f04,False,
430.0,HITL-Operator-90,Success,Agent was able to find and list 3 articles related to Beyonce.,https://www.loom.com/share/4727f42511514081a3f8553a4b57c304,False,
433.0,HITL-Operator-91,Success,Agent was able to scan the page and list two relevant benefits for businesses. ,https://www.loom.com/share/097e21b69661497ca51b11b0f12c34d0,False,
432.0,HITL-Operator-92,Failure,"Agent struggled to locate Los Angeles, and scrolled too far to the point where ""select a city"" was off the screen, and it started to try and select a county. This was inconvenient for the user, so designated this task as a ""fail.""",https://www.loom.com/share/4ee8fe23b9e04c379aec8472e2c5e4b0,False,"The issue described is related to the AI agent's navigation and interaction with the webpage. It involves the agent failing to correctly locate and select the correct item ('Los Angeles') and incorrectly scrolling past the desired option. This is not an infrastructure issue, as it does not involve problems with the underlying browser infrastructure like login, proxy, captcha, or website loading."
449.0,HITL-Operator-93,Success,Agent managed to find the top 3 features articles on the website.,https://www.loom.com/share/25a2efd933534b9c82b7ec7498954bf5,False,
440.0,HITL-Operator-94,Failure,"Agent worked up to a point where it was not on the target website anymore. Before getting to this point, it failed to identify articles, notably taking ""featured culture articles"" as a literal term to search rather than looking for the featured articles.",https://www.loom.com/share/3154ffde23874dc18769d4b22792943a,False,"The issue described involves the agent failing to correctly interpret search terms and locate relevant articles, which is a problem with the logic or algorithm of the AI agent itself, not with the underlying infrastructure such as logins, proxies, captcha, or website loading."
446.0,HITL-Operator-95,Success,Agent found an article from each of the decades required. ,https://www.loom.com/share/cf4d5c1cacf64dc2a86c9142ad7403d4,False,
443.0,HITL-Operator-96,Failure,Agent ultimately could not find the section to manage preferences.,https://www.loom.com/share/5eb7c2e8fb9d457a887eeff46501c54f,False,"The error described is related to the AI agent's ability to navigate and locate specific sections on a webpage. This is an issue with the agent's navigation or understanding of the page layout, not the underlying infrastructure."
442.0,HITL-Operator-97,Success,Agent found an article and drafted a proper message to share to Linkedin.,https://www.loom.com/share/22fd577eaac542e0a71fc04757e42126,False,
445.0,HITL-Operator-98,Failure,"Agent got logged out twice, and struggled to post the comment multiple times. Agent notably input a username longer than 15 letters, which was the maximum character limit, and struggled to reduce the count to only 15 characters.",https://www.loom.com/share/e824bbbe7ae04027a8fb45e016d47c56,False,"The issue described involves the AI agent struggling with a username input longer than the character limit and difficulties in posting a comment. These are related to how the agent handles user inputs and executes actions, which are aspects of the agent's functionality rather than issues with the infrastructure."
453.0,HITL-Operator-99,Success,"Agent was able to log in, with human guidance on which account to use. ",https://www.loom.com/share/26f183a04728493795e08fd0e21e727d,False,
460.0,HITL-Operator-100,Success,Agent was able to access the help center and find the necessary guidelines as tasked.,https://www.loom.com/share/ba891de7228f41d6bc4b47a9a2cc4899,False,
,HITL-Operator-101,Failure,"Agent was unable to set the proper date range, so designated this task a fail",https://www.loom.com/share/cceefb5529e7438a912b7d5f5b2ec729,False,
,HITL-Operator-102,Success,Agent was able to book the desired hotel as a last minute booking.,https://www.loom.com/share/0444c01d23654b26b55c09b2f811d52f,False,
481.0,HITL-Operator-103,Success,Agent was able to find and list three flights as desired. ,https://www.loom.com/share/29d80c80a38a4018ada37ec7896651fb,False,
,HITL-Operator-104,Bad Task,Agent is able to make an itinerary and book flights and hotels.,https://www.loom.com/share/1da2483151334cf19c987a7031945315,False,
,HITL-Operator-105,Success,"Agent was able to create the itinerary and identify and select the necessary flights,.",https://www.loom.com/share/439c9247c2c64da08ede3d13492a58a5,False,
466.0,HITL-Operator-106,Bad Task,"Agent was able to create ""Family Fun"" itinerary including flight. Human stopped at flight due to transaction requirement.",https://www.loom.com/share/f6983eb2d5ce44c0b61f959664bd5b55,False,
,HITL-Operator-107,Bad Task,"Agent was able to add flight and hotel stay and asked for confirmation on dates for stay, but required payment.",https://loom.com/share/fa5fc6b553b84cada821da6861b33dbd,False,
488.0,HITL-Operator-108,Failure,Agent was unable to create the page after an error of multiple failed attempts to create a page.,https://www.loom.com/share/399e3a4c5bad44469cf74499a5656fb3,False,"The issue described is related to the AI agent's functionality of creating pages, which involves task execution logic and not the underlying infrastructure such as login or webpage access. This indicates a problem with the agent's behavior in handling page creation errors, thus it is not an infrastructure issue."
489.0,HITL-Operator-109,Success,"Agent successfully made a post on Facebook, with a clickable link that the human provided.",https://operator.chatgpt.com/c/67f587b21d088190bc24adf4a0afed1d,False,
496.0,HITL-Operator-110,Success,"Agent successfully posted a test post and deleted it. Agent notably asked to delete it from the recently deleted file, which human approved.",https://www.loom.com/share/894a08b091b24bb4aaa7af62a3847326,False,
495.0,HITL-Operator-111,Success,Agent was able to navigate to reels and save the first reel it encountered.,https://www.loom.com/share/a595266e0e9b4b6982e24534afcc0206,False,
505.0,HITL-Operator-112,Success,Agent was able to locate an image and provide a link to its dimensions. Agent needed human confirmation to move to the next image after the first image did not provide its dimensions.,https://www.loom.com/share/747a723f645f4190ba5140e84872b072,False,
508.0,HITL-Operator-113,Failure,Human timed the agent out due to inconvenience of time taken by agent to figure out task. ,https://www.loom.com/share/0b2a0d95155c4fabbb7273ba20d945aa,False,"The issue is related to the time the agent took to process the task, which indicates a problem with the agentâ€™s task handling or efficiency, not an infrastructure issue."
521.0,HITL-Operator-114,Success,"Agent was able to identify that Firstcry Prime had changed to Firstcry Plus, and provided benefits on it.",https://www.loom.com/share/fac08f80b2664778b77715b54bf00cca,False,
517.0,HITL-Operator-115,Success,Agent stalled for a bit but then was quickly able to identify three strollers as tasked.,https://www.loom.com/share/c615374eded1429493b67b77fbb662d9,False,
516.0,HITL-Operator-116,Failure,"Agent was unable to log in, as website was unable to register phone number.",https://www.loom.com/share/82426946187d43429ec9d8f3a0a1b66f,True,"The issue described is related to the infrastructure, specifically a login problem where the website itself failed to register the phone number, preventing the agent from logging in."
519.0,HITL-Operator-117,Success,"Agent was able to find a ""maternity support belt"" and extract pricing and additional details.",https://www.loom.com/share/9e70f36e9647421aad3501fc7764fd4e,False,
531.0,HITL-Operator-118,Failure,"Agent timed out - got suck in a loop of looking to camera roll to find photos that hadn't been uploaded, and failed to ask user to upload photos.",https://www.loom.com/share/01893d8a73754a5a9efd2f2b8e1c7c0c,False,"The error is related to the agent's functionality in navigating and interacting with a feature (camera roll) and making decisions, rather than an infrastructure issue such as logging in or loading websites."
542.0,HITL-Operator-119,Bad Task,Agent couldn't upload photos because no photos are on the browser.,https://www.loom.com/share/f8777bedd4b645b8a488d22c47e7ebf1,False,
537.0,HITL-Operator-120,Success,"Agent was able to return the names of the first few titles labelled ""Sunset.""",https://www.loom.com/share/edf3b136bfe148dca626537dd56e78d6,False,
538.0,HITL-Operator-121,Success,Agent was able to extract metadata details of the photo it selected.,https://www.loom.com/share/18dd9b1455e3439795564e4e2609f51d,False,
528.0,HITL-Operator-122,Bad Task,Agent couldn't upload photos because no photos are on the browser.,,False,
545.0,HITL-Operator-123,Success,Agent was able to locate and report top 5 results including price and other details as asked.,https://www.loom.com/share/ce2bf908e90c4c939adfac9137198b09,False,
543.0,HITL-Operator-124,Success,"Agent was able to aggregate the total of the three discount it saw, and averaged it out. ",https://www.loom.com/share/0e9958e2a67a44dd96a951f42b11c7f7,False,
553.0,HITL-Operator-125,Failure,"Agent was not able to find the ""A few of our faves"" section. Human timed it out, because agent was headed down an incorrect path that was unlikely to succeed.",https://www.loom.com/share/953b2059719c459880db4f0080aa1d11,False,"The error described involves the agent's inability to locate a specific section of a webpage, which led to it taking an incorrect path. This indicates a navigation issue related to the AI agent's logic or design, not the infrastructure supporting it. Therefore, it is not an infrastructure issue."
554.0,HITL-Operator-126,Success,Agent found a recipe with lemon and thyme ingredients and listed out the steps to make it.,https://www.loom.com/share/8e5452cae0da45fcb9c17dc0352b4fc3,False,
552.0,HITL-Operator-127,Success,"Agent found the first three post titles and usernames related to ""grilling.""",https://www.loom.com/share/9c629e4960074aa2a2a26ed050947e86,False,
567.0,HITL-Operator-128,Success,"Agent successfully designed and saved a build, and proceeded to delete it afterwards. Agent asked for human to submit zip code and log in.",https://www.loom.com/share/0645b4da79f64544bf4ba0bff6aa9e09,False,
565.0,HITL-Operator-129,Success,Agent was able to report out a credit financing option for a Ford Fusion including monthly payment and term details.,https://www.loom.com/share/83139f880a1641e4a8197440377c29c3,False,
564.0,HITL-Operator-130,Success,"Agent was able to create the custom build and save it to the collection, and return the build reference as a url.",https://www.loom.com/share/9f42fa69206c4df49514eb2e08dbfcf4,False,
575.0,HITL-Operator-131,Bad Task,Accessing Fortune 500 rankings requires payment/subscription,https://www.loom.com/share/c30adc8f363643f2812cc8edeeb98205,False,
574.0,HITL-Operator-132,Success,Agent was able to find and return the titles of the top 5 features business articles.,https://www.loom.com/share/819fe591f0a8460199c7e89b9ed01ccc,False,
578.0,HITL-Operator-133,Success,"Agent was able to find an archived article about ""immigration policy.""",https://www.loom.com/share/2f259f6f60f446ee920aa0da0171f4a2,False,
577.0,HITL-Operator-134,Success,Agent was able to find an article related to US economy and summarize the main points from the introduction.,https://www.loom.com/share/486e862425cc49e4ad39f823560dd2f9,False,
582.0,HITL-Operator-135,Success,"Agent was able to find the nba highlights, but had to have human instruct it to navigate to the NBA channel before it successfully identified the highlights, as it was stuck beforehand.",https://www.loom.com/share/efeacefe21494adc9e4888955fd1da45,False,
591.0,HITL-Operator-136,Failure,"Agent failed to locate any details on file format availability, even after human prompting in the right direction.",https://www.loom.com/share/37cd1870ec1641a3a8cd85b90ccd2b6d,False,"The issue described is related to the autonomous AI agent's ability to find and understand information on file format availability, which falls under the category of 'Information retrieval issues.' It does not involve any issues with the infrastructure like login, proxy, captcha, or web page accessibility issues."
604.0,HITL-Operator-137,Success,"Agent was able to find and return 5 articles related to ""Cyberpunk 2077.""",https://www.loom.com/share/57a04d8a25764f0ea9979bf60d4dfcf9,False,
609.0,HITL-Operator-138,Failure,"Agent was able to create and post a comment on the desired article, but GameRant has to approve the comment before it can be updated, which takes ~24 hours. Due to the fact that the comment could not be updated, task is failed.",https://www.loom.com/share/e87f32e12dbd44f68ff2754626d46e79,False,"The issue described relates to the approval process of comments on GameRant, which affects the completion of the task by delaying it. It is not related to infrastructure such as login, proxy, or website loading issues. Rather, it is a procedural or policy-related issue specific to the website's comment approval system. Therefore, it is not classified as an infrastructure issue."
608.0,HITL-Operator-139,Failure,"Agent got stuck and then navigated to bing to search, which is out of bounds for the task.",https://www.loom.com/share/a5f12c5975384a8196fd2729ae0fbd91,False,"The error is related to the agent's behavior, specifically its navigation logic and ability to stay within task boundaries. It is not an issue with the underlying infrastructure like logging in, proxy, captcha, or website loading."
612.0,HITL-Operator-140,Success,Agent was able to change the display name to the desired name as tasked.,https://www.loom.com/share/d9cb3628ad184695871b8d053468ecc0,False,
615.0,HITL-Operator-141,Success,Agent was able to locate the score of the review and list three key elements of the review as well.,https://www.loom.com/share/0beadeff71c44d84839bfddf7d6dd011,False,
622.0,HITL-Operator-142,Success,"Agent returned the top three relevant articles on ""comics"" as tasked,",https://www.loom.com/share/168a6d1d9e53440f9be47031b35b2e0f,False,
620.0,HITL-Operator-143,Failure,"Agent was unable to find the comment section on the article, even when human interjected to push the agent farther down the page when scrolling.",https://www.loom.com/share/68722a4cc1ce478a86f3530be0c58b10,False,"The issue is related to the AI agent's failure to correctly navigate and locate specific elements on a web page (the comment section), even with human assistance. This is a problem with the agent's navigation logic, not the underlying infrastructure."
652.0,HITL-Operator-144,Success,Agent was able to fork the repository to the account as tasked.,https://www.loom.com/share/a6478d018af24dd68aaf215bef6e6d56,False,
661.0,HITL-Operator-145,Failure,"Agent was not able to locate branch options within a reasonable timeframe, so user timed out the agent.",https://www.loom.com/share/0cb1f053ca034e9cab31aff0d783b22b,False,"The issue is related to the AI agent's inability to locate information (branch options) in a timely manner, not an infrastructure problem. This falls under navigation or information retrieval issues unique to the agent's performance."
660.0,HITL-Operator-146,Success,"Agent created the repository and then deleted it. Notably, agent asked for confirmation 3/4 times, each time prompted by the website to do so,. ",https://www.loom.com/share/40dbbae0e02c42c2baccd5637e9ecd92,False,
672.0,HITL-Operator-147,Success,Agent created the repository and required one review before merging changes. ,https://www.loom.com/share/67ba45175b1c4e15b00bdddabb47fef2,False,
689.0,HITL-Operator-148,Success,"Agent looked at multiple interview accounts to aggregate interview question data, and returned the most common question asked by these accounts.",https://www.loom.com/share/b5bf8a992a1841429d4ff4ee64149b97,False,
688.0,HITL-Operator-149,Failure,"Agent used the Bing search tab, rather than attempting to navigate the website.",https://www.loom.com/share/96ec82fe51374df38abc166dc1ac5ab0,False,"This issue is related to the AI agent's behavior in choosing how to perform its tasks (using search functionality instead of directly navigating the website). It is a logical or navigation decision made by the agent, not related to infrastructure."
680.0,HITL-Operator-150,Success,Agent was successfully able to create a post about work-life balance on glassdoor,https://www.loom.com/share/61816c93c75a40e5a8adba39fdf642fe,False,
687.0,HITL-Operator-151,Success,"Agent was successfully able to post a comment and then delete it later as well, surprising thing is the delete operation was so fast that i was not able to notice it.",https://www.loom.com/share/335ba4a0fa954959a95b684f362f3d67,False,
695.0,HITL-Operator-152,Failure,"Agent failed to look for summary or insights or key movements of the match, it only focused on find the key words which weren't directly available ",https://www.loom.com/share/6794d3e02fb04525ba483cd019a8f6d2,False,"The error is related to the AI agent's ability to retrieve information, specifically focusing on incorrect keywords for information extraction. This is a non-infrastructure issue as it pertains to the agent's logic or functionality rather than the underlying infrastructure."
703.0,HITL-Operator-153,Success,"Agent successfully added a receipe and then deleted it as well, however there was no option available to create a personalized list",https://www.loom.com/share/7c43978aa58f4f1290ed7fcabd1edf8e,False,
705.0,HITL-Operator-154,Bad Task,Agent failed to find the option to Unsubscribe the newsletter subscription as it was not present in the account settings,https://www.loom.com/share/f432d1c06e9f4193b089222a15f87a08,False,
701.0,HITL-Operator-155,Success,"Agent successfully wrote a comment for a product review with a little help, however there is no option present to add a star rating for the product",https://www.loom.com/share/29b198ddf2a445b7ae5175b39f3abdb4,False,
710.0,HITL-Operator-156,Success,Agent was successfully able to extract required information,https://www.loom.com/share/a187daae33434e05bc1d2df78c553270,False,
715.0,HITL-Operator-157,Success,Agent was successfully able to extract top three user reviews from the given book,https://www.loom.com/share/55b2719fa11c460fbd89e98d991e1e1f,False,
737.0,HITL-Operator-158,Success,Agent was successfully able to compare the prices of sane itens from different state and there was a very little difference noticed ,https://www.loom.com/share/9dbc7e04add4469c81698fabca6a7e9c,False,
746.0,HITL-Operator-159,Success,Agent was successfully able to find and summarize 5 FAQ's from the catering section,https://www.loom.com/share/2e378793790c4e78aa5c68eb5917958e,False,
739.0,HITL-Operator-160,Success,Agent was successfully able to add latte to the cart and place an order for me with updating the delivery instructions as suggested,https://www.loom.com/share/1c6751013e374a379d95741fecbbf6e9,False,
751.0,HITL-Operator-161,Success,Agent successfully found the article and it did extract the required information,https://www.loom.com/share/90298b7270d946b380a489e52bcf82e7,False,
754.0,HITL-Operator-162,Bad Task,Agent failed to find the exact article mentioned in the task as it is actually not present on the website,https://www.loom.com/share/52cad1fb9ec74d809a1e9efa97f809bc,False,
756.0,HITL-Operator-163,Success,Agent successfully extracted the information requested to it,https://www.loom.com/share/46c6b7729b1847b89cff7890971ed76f,False,
758.0,HITL-Operator-164,Success,Agent did pull the 5 articles from featured section not directly from the homepage but it is still somewhat correct,https://www.loom.com/share/245febbd34d94cf9afabcf4ac05ca51e,False,
765.0,HITL-Operator-165,Success,Agent was successfully able to find the sale section and pull the discount percentage on the first product,https://www.loom.com/share/1c8bc36e7d5a46c9bedfadf2b58d4b9b,False,
771.0,HITL-Operator-166,Failure,Agent failed to find the exact product mentioned in the task,https://www.loom.com/share/55ffa3c0146842a394abb279a153ecc2,False,"The issue is related to the AI agent's ability to accurately locate specific products, which falls under navigation or information retrieval issues, not an infrastructure problem."
775.0,HITL-Operator-167,Success,Agent surprisingly had a live chat with an live agent on the other side by first providing the contact information and then asking the question with a brief description.,https://www.loom.com/share/a40b11fbe8554963914064c4bf09710c,False,
782.0,HITL-Operator-168,Success,Agent did filter the luber according to the requirements and at the end gave an convincing answer,https://www.loom.com/share/5481befa7b4947ba907891426fc46a41,False,
793.0,HITL-Operator-169,Success,Agent successfully filtered hotels with required amenities and extracted top 3 hotels info,https://www.loom.com/share/c3729852497f47e2b529b03d5a94a417,False,
799.0,HITL-Operator-170,Success,Agent successfully found the signup section for receiving new articles and signed up for it,https://www.loom.com/share/849ba26d01154bc5ac3d7c31df1fcab3,False,
797.0,HITL-Operator-171,Bad Task,Agent was only able to add one article to My Bookmarks as it is the maximum one could save,https://www.loom.com/share/f8628b8706e24cef8b7452f8d5ff5285,False,
804.0,HITL-Operator-172,Failure,Agent failed to open the webpage,https://www.loom.com/share/d6b85a1b2a4b4a9ab72cb7d4547e4694,True,"The error is classified as an infrastructure issue because the agent's failure to open the webpage is related to accessing the content, which is a general website loading issue."
808.0,HITL-Operator-173,Bad Task,Agent was not able to find any subscriptions on the account and the newsletter was already subscribed but there was no option to change its preferences,https://www.loom.com/share/4b2d558f40634dc1a54c0aa829f7f29f,False,
800.0,HITL-Operator-174,Bad Task,Agent was not able to find any subscriptions on the account and the newsletter was already subscribed but still there was no option to find that subscription let alone canceling it,https://www.loom.com/share/a024bbc98601481db1a5908f87db06ff,False,
817.0,HITL-Operator-175,Bad Task,"Agent was not able to find article mentioning ""Tesla"" in their title as it was not available anywhere",https://www.loom.com/share/7e5d0c5840514d79ab6f754731713c59,False,
819.0,HITL-Operator-176,Failure,"Agent failed to access the website directly due to an error ""Site Unavailable""",https://www.loom.com/share/294a578b2cf946d9b85887eddda150a4,True,"The error 'Site Unavailable' indicates that the website is not accessible. This is a general website loading issue, which is classified as an infrastructure issue because it relates to the website being unreachable rather than a problem with the functionality of the AI agent itself."
839.0,HITL-Operator-177,Success,Agent succcessfully navigated to the account settings and updated the instructions in saved address,https://www.loom.com/share/35d20a7ec5794273b0544dc5122cb4ce,False,
827.0,HITL-Operator-178,Success,Agent successfully found the product page and submitted a positive review as mentioned,https://www.loom.com/share/0bc81cc284914ee3b3074e3a1606815d,False,
829.0,HITL-Operator-179,Bad Task,Agent was not able to find the specific product mentioned as it was not available on the page anywhere,https://www.loom.com/share/153c32e95da8429198461127673fb31b,False,
850.0,HITL-Operator-180,Success,Agent successfully found the job as mentioned and added to saved list,https://www.loom.com/share/984904cca7f84df9bc088cf5ad36a8b3,False,
854.0,HITL-Operator-181,Success,Agent successfully finds the title of the articles,https://www.loom.com/share/f3cbc4362f954493b55d605e27d44f4f,False,
856.0,HITL-Operator-182,Failure,"Agent failed to access the website due to an error ""Site Unavailable""",https://www.loom.com/share/71f0e766d2ed49ccbc74d94784284774,True,"The error indicates a website loading issue, which is related to the infrastructure accessing the site, rather than a problem with the AI agent itself. This fits the category of a general website loading issue."
860.0,HITL-Operator-183,Failure,"Agent failed to access the website due to an error ""Site Unavailable""",https://www.loom.com/share/ba1f8594e18540bc8c3c0608430235da,True,"The error 'Site Unavailable' indicates that the website is not accessible, which is a general website loading issue. This is an infrastructure problem as it is not related to the AI agent's functionality but to the accessibility of the internet resource it is trying to reach."
861.0,HITL-Operator-184,Failure,"Agent failed to access the website due to an error ""Site Unavailable""",https://www.loom.com/share/0f04c3cd677740f088ed0feb10bf6d3f,True,"The error 'Site Unavailable' suggests that the website cannot be accessed, indicating a general website loading issue. This is related to the infrastructure as it affects the agent's ability to access the website."
875.0,HITL-Operator-185,Success,Agent successfully found the item requested and added it to the shopping cart,https://www.loom.com/share/e2109f74db3644998bbf71c6412fbe0b,False,
873.0,HITL-Operator-186,Success,Agent successfully found a item which did contain peanut butter and jelly and added it to the cart to display the estimated delivery time,https://www.loom.com/share/ef977079aac6451c8da3598b5f1d1ac9,False,
883.0,HITL-Operator-187,Success,Agent successfully found the organic bananas from three different stores and retured there prices respectively,https://www.loom.com/share/07ae754082344723a4f90db27488013d,False,
