ID,HITL_Operator_ID,operator_hitl_eval,operator_hitl_reasoning,operator_hitl_link,HITL_Infra_Error,HITL_Infra_Error_Reasoning
2.0,HITL-Operator-1,Success,Navigates and finds correct items via search,https://www.loom.com/share/85352b1277d84363b16101550ee27766,False,
22.0,HITL-Operator-2,Success,Agent succesfully goes and finds options and clicks in to extract info from each listing,https://www.loom.com/share/93627d5d5cd543edbc98f6372f711dcc,False,
20.0,HITL-Operator-3,Failure,"AI Agent failed to delete. could not find delete option. Instead chose to archive the whole message, failing task. ",https://www.loom.com/share/60832434f452439c8e1d9fc12ab3ea4c,False,"The error is related to the AI agent's logic or algorithm, as it failed to identify and perform the correct action (deleting a message) and mistakenly archived it instead. This is not related to infrastructure, which would include issues with logging in, proxies, or page loading."
19.0,HITL-Operator-4,Success,"AI Agent successfully selected guest favorite property listing, saved it to wishlist, and deleted it with confirmation from human.",https://www.loom.com/share/d72f7868dc2e4172bbc020fbfe17cbdc?sid=06ba2a9b-89c1-4b29-982d-afd857147870,False,
35.0,HITL-Operator-5,Success,"AI Agent successfully completed the task. Interesting to note, Agent first searched by category instead of going to search bar, but corrected. Additionally, Agent answer included the same supplier twice, as it was listed with a different product. Answer is technically correct. ",https://www.loom.com/share/c64d0336840e41f4bee5f5b690a059e7,False,
34.0,HITL-Operator-6,Success,"AI Agent successfully completed the task. However, the agent needed human intervention to complete the CAPTCHA popup.",https://www.loom.com/share/b8f587b608f3485aaab7eb317397f425?sid=45e4678c-f8a4-44c7-b1bb-f48e66dfee62,False,
33.0,HITL-Operator-7,Success,AI Agent successfully locates a number for the amount of listings of smartphones on Alibaba. ,https://www.loom.com/share/bb3f8b6626124e35a42b862c35bf2e02,False,
51.0,HITL-Operator-8,Failure,"Hits ""Signal - Not Acceptable"" error when navigating into the webpage for the recipe. Tries navigating to incognito and via search but both paths fail",https://www.loom.com/share/e2d32b9e72d34c0788a85fadd95a9718,True,"The error ""Signal - Not Acceptable"" when attempting to navigate a webpage suggests an issue related to proxy, CAPTCHA, or other access restrictions that are typically infrastructure issues. The AI agent's alternative attempts to use incognito mode or search did not resolve the issue, further indicating it is an access or loading problem, aligning more with infrastructure challenges."
67.0,HITL-Operator-9,Success,"Agent successfully navigated and found the calorie count. Notably, Agent could have clicked ""Jump to nutritional facts"" but scrolled instead. ",https://www.loom.com/share/b1be71530e1043ce98cf0c5c1b80c7a9,False,
63.0,HITL-Operator-10,Success,"Agent successfully found a serving size for a recipe designated for the fall time of the year. Interestingly, the Agent identified Halloween as a Fall time of year as opposed to searching in the search bar for ""Fall"".  ",https://www.loom.com/share/4cd22d81732c4d69be2ca3f4ffe7c581,False,
56.0,HITL-Operator-11,Failure,"Agent created a new collection titled correctly. Agent checked back with Favorites Tab to check if it had properly favorited an item before continuing to search for recipes. Agent added 4 recipes, and noticed that there was only four recipes in the collection. Agent misidentified the missing recipe, and attempted to add that recipe again. The agent checked for that specific recipe to be in the collection, yet ignored checking that there were 5 recipes in the collection overall. Thus, it misidentified the number of recipes, and populated a collection with 4 recipes instead of 5. ",https://www.loom.com/share/39cbb83e3c90456781acae3726f934f7,False,"The described issue involves the agent misidentifying the number of recipes in a collection and not properly verifying the total count. This is a problem related to the agent's logic or algorithm for managing collections, rather than an infrastructure issue like network, captcha, or login problems."
73.0,HITL-Operator-12,Success,"Agent saved the trail and successfully deleted it. Agent needed human assistance to log in, as well as navigate to browser settings to allow third-party cookies for log-in portal. Agent also needed human assistance to confirm the save and delete functions.",https://www.loom.com/share/da0184a08aa347938290fc0f21e9b25d,False,
80.0,HITL-Operator-13,Success,"Agent selected ""hiking,"" as it wasn't previously saved as a favorite. Then it changed its response to ""mountain biking,"" constituting a success.",https://www.loom.com/share/bd57ff75e59f4e20a4045c1b3a4d81f1,False,
70.0,HITL-Operator-14,Bad Task,"Agent found a trail called ""Fig Tree Falls Loop,"" which was the closest alternative. There exists a trail called ""Fig Tree Loop,"" but it isn't listed on alltrails.com",https://www.loom.com/share/44c339c4195948529addd476bd9c38ed,False,
93.0,HITL-Operator-15,Success,"Agent filters for all the necessary criteria, and lists the desired output. Agent first searched for the titles within the year 2022, and then narrowed the search by filtering for articles alone.",https://www.loom.com/share/138e4d0f4d9c4ce4828cbdef5d7ee6d8,False,
87.0,HITL-Operator-16,Bad Task,"Agent was unable to save a note to MyAPA, so this is a bad task. Agent was able to copy summaries, and after being asked to return the summaries copied, the agent returned a few blurbs about each summary, rather than a larger paragraph. Agent also required human assistance to log in.",https://www.loom.com/share/f51598d9578c409a840a969f404c8c9d,False,
96.0,HITL-Operator-17,Bad Task,"Agent was unable to change the biweekly update into a monthly subscription, as the specific newsletter did not allow it to. Instead, the agent subscribed to a different newsletter that had a monthly frequency.",https://www.loom.com/share/53b3a1a2636e4dff8f4eb1f6a27098e7,False,
102.0,HITL-Operator-18,Success,Agent was able to find the necessary details for Spotify's version release date and latest version number. Agent needed human assistance to complete CAPTCHA verification.,https://www.loom.com/share/79b47ee0d25846e5b28a6386d73dc134,False,
104.0,HITL-Operator-19,Success,"Agent was able to successfully return the top article names for ""climate change"" search.",https://www.loom.com/share/84350e0bf560465682535f1acf37abbe,False,
113.0,HITL-Operator-20,Success,"Agent successfully navigated to the Advanced Search function and input ""space"" as the description field, and media type as ""image"". Then it returned the capture date and titles of the first ten images. Agent did require two searches and approval from human to proceed with searches.",https://www.loom.com/share/3948c0065c4f4d9295d73f72d90d1800,False,
116.0,HITL-Operator-21,Success,Agent successfully found the UK size 12 measurements. ,https://www.loom.com/share/212c7880cfa4495cab4331e9a6734ee3,False,
129.0,HITL-Operator-22,Success,Agent successfully identified the closest B&N to zip code 90210 when presented with multiple options.,https://www.loom.com/share/a5512e8360ba4b99bdcaf99c86a3b745,False,
125.0,HITL-Operator-23,Success,"Agent requested human assistance to proceed with security risk, and also log in. It identified the proper book, asked for confirmation to add it to the wishlist, and checked to make sure it was in the wishlist. Agent struggled to add the book to the wishlist on its first 3 attempts(figuring out which functions add the books to the wishlist), and had to re-search the book a few times. It then properly identified the method to add books to the wishlist and with confirmation, proceeded. Then Agent asked for confirmation to delete it before completing. ",https://www.loom.com/share/28d123708a074a6c8d788714df11e925,False,
139.0,HITL-Operator-24,Success,"Agent did successfuly find the first restaurant listed and identified where the rating would be, but this specific restaurant did not have a rating. It asked if it should keep looking, and after browsing more, decided to filter for restaurants with ratings. The drawback of this method/question is that the BBB rating filter only allows you to select one rating at a time, so the Agent was only able to find restaurants with the given rating that it selected in the filter. ",https://www.loom.com/share/e73525e3052a440597389d10a88c6d5d,False,
140.0,HITL-Operator-25,Success,Agent was able to successfully identify the first 5 businesses listed with an A+ rating,https://www.loom.com/share/0d63cc5a6aaf4e5c819d8d5e57ff3ebe,False,
151.0,HITL-Operator-26,Failure,Gateway error ,https://www.loom.com/share/52c28e65062149fa90e974d254b6dfa1,True,"A 'Gateway error' typically refers to an issue with the server infrastructure or network connectivity, rather than a problem with the AI agent itself. This error often means that there is a problem with the service or network path that the agent is using to access a particular website or resource."
159.0,HITL-Operator-27,Failure,"Agent did not source the guide directly from BestBuy; rather, Agent looked up the name of the guide in a separate tab on Bing. Agent also tried to identify tips by searching for tips as a key word, and then tried to locate a Help or How-To section. Lastly, it summarized 3 succinct tips for selecting a TV.",https://www.loom.com/share/2367be1048104d73a0c10d5cd6de7741,False,"This issue describes the AI agent's behavior in retrieving information, such as using Bing to search for a guide instead of accessing it directly from BestBuy. It focuses on the agent's logic and decision-making process in locating and summarizing information. Therefore, it is a non-infrastructure issue."
162.0,HITL-Operator-28,Success,Agent successfully added the item to the cart for delivery and changed it to pickup at the nearest address.,https://www.loom.com/share/a5d861d524c9459fad82b3c562182286,False,
149.0,HITL-Operator-29,Success,Agent was able to create a wishlist in the account and add the desired TV to the wishlist. Agent needed human assistance to log in several times and would frequently get logged out. Agent also misclicked multiple times before successfully saving the desired TV.,https://www.loom.com/share/88f9901daf4e4431b40ac59835212350,False,
172.0,HITL-Operator-30,Success,"Agent was able to find two hotels that meet the desired criteria. However, Agent's method was not the most efficient, as it filtered for hotels with a balcony at one point, among other inefficient search criteria. ",https://www.loom.com/share/8b64cc7fc3794d7093cb0151cf7a161d,False,
188.0,HITL-Operator-31,Success,Agent was able to identify the name and length of the featured video on BuzzFeed,https://www.loom.com/share/b819d5209117424fb5bc4b1d146f9b5e,False,
185.0,HITL-Operator-32,Success,Agent successfully identified 5 quiz names that it was tasked to do. ,https://www.loom.com/share/45a8f6bce20446849668fadd08a23b26,False,
180.0,HITL-Operator-33,Success,"Agent created and saved the post successfully. Agent asked to include thumbnail, which human told agent to continue without. Agent also needed assistance to log in.",https://www.loom.com/share/3dc0b5de3c6546f399fbf63748e19dcb,False,
183.0,HITL-Operator-34,Success,"Agent successfully commented and deleted its comment, and requested approval from human before commenting and deleting.",https://www.loom.com/share/1e5957bb1324419e9ca9d85b61902ea5,False,
178.0,HITL-Operator-35,Bad Task,"Agent successfully generated a post, but couldn't post because lack of image requirement. Human instructed it to save task instead, which it was able to do. ",https://www.loom.com/share/badc7aaa71b74a42b8236a96ffe6906f,False,
198.0,HITL-Operator-36,Failure,"Agent noted two guidelines rather than outlining three distinct ones. One could argue that the agent noted more than three, but in either case, agent failed to outline three distinct guidelines.",https://www.loom.com/share/a86c6c1e8f184fabb0e33bda6cc392f7,False,The error describes an issue with the AI agent's ability to fulfill a task related to identifying or counting guidelines. This is a problem with the agent's logic or information retrieval capabilities rather than an infrastructure issue.
206.0,HITL-Operator-37,Success,"Agent was able to identify an article, bookmark it, and then unbookmark it and confirm. However, it needed human assistance to verify all of these actions. ",https://www.loom.com/share/1262049f0dc8478f95a3c78934473e7e,False,
204.0,HITL-Operator-38,Failure,"Agent came to the conclusion that Car and Driver doesn't have the comment feature. Multiple articles on Car and Driver have comments available, so this constitutes as a failed task.",https://www.loom.com/share/0b5ffe8a314447f9a9e85b2bbcccb526,False,"This issue relates to the AI agent's ability to properly detect and recognize the comment feature on the Car and Driver website. It seems to be an information retrieval or navigation problem, as the agent incorrectly identified the presence of a comment feature. Therefore, it does not classify as an infrastructure issue."
209.0,HITL-Operator-39,Success,Agent was able to find 3 featured reviews on the front page. ,https://www.loom.com/share/4f73dbc16010432390ac460edd4386c1,False,
213.0,HITL-Operator-40,Success,Agent was able to find multiple pricing/incentive components for the BMW series 3 330e.,https://www.loom.com/share/49099a8e9d944d52ade7f37246b3af13,False,
221.0,HITL-Operator-41,Failure,Agent consistently tried to play video when it should have collected the link to the videos instead.,https://www.loom.com/share/67f242fa08154ddf85941e5f1dc3f582,False,The issue is related to the AI agent's behavior and not the infrastructure. The agent's logic or instructions regarding collecting video links are incorrect or not aligned with the intended task.
220.0,HITL-Operator-42,Success,Agent was able to locate and report 5 top articles from the news section.,https://www.loom.com/share/38c7e87875204c9ba2e37a897d813fbf,False,
222.0,HITL-Operator-43,Success,Agent successfully found Star Wars-related articles and summarized them efficiently.,https://www.loom.com/share/0da9b1fea9854df9a52b7480e53f1deb,False,
228.0,HITL-Operator-44,Success,Agent successfully navigated through CBS Sports and found the next two events streaming.,https://www.loom.com/share/81b96de835d246d6bf13ad15083c416c,False,
231.0,HITL-Operator-45,Success,Agent successfully identified the most recent advisory and summarized it succinctly.,https://www.loom.com/share/91dc8d0139ee482086b1519694a3598d,False,
236.0,HITL-Operator-46,Success,Agent successfully identified the top 5 most relevant articles on heart disease as prompted.,https://www.loom.com/share/c509ec8303b6495680a001a68298f94b,False,
249.0,HITL-Operator-47,Failure,"Agent failed to access the site, and human could access on same browser. ",https://www.loom.com/share/46abbfeba2da45e885a1809d1366f8a4,True,"The issue is labeled as an infrastructure problem because it involves the agent's inability to access a site that is otherwise accessible by a human on the same browser. This suggests an issue with the underlying browser infrastructure, such as permissions or configurations related to the autonomous agent, rather than an issue with the agent's logic or behavior."
243.0,HITL-Operator-48,Failure,"Agent failed to access the site, and human could access on same browser. ",https://www.loom.com/share/8d75c3b32e9d4d8bb6c461946edae288,True,"The issue described is related to the agent's ability to access the site, which falls under general website loading issues, suggesting it is an infrastructure problem."
241.0,HITL-Operator-49,Failure,"Agent failed to access the site, and human could access on same browser. ",https://www.loom.com/share/e4a02dc0d4b34ea5aeae2e7215d3ae2c,True,"The issue suggests that the agent is unable to access the site while a human can on the same browser, which indicates a potential infrastructure issue related to proxy settings or some kind of automated access blocking, which the infrastructure manages."
247.0,HITL-Operator-50,Failure,"Agent failed to access the site, and human could access on same browser. ",https://www.loom.com/share/a9ecb32027af465bb06317193e2ff5bd,True,"The error suggests that the agent failed to access the site while a human could access it using the same browser. This is indicative of an infrastructure issue, as it points to a potential problem with how the agent interacts with the web infrastructure, such as a proxy or bot detection issue, rather than the functionality of the agent itself."
261.0,HITL-Operator-51,Failure,"Agent used the browser search function rather than the site search function, and also left the site to search bing before returning to the website.",https://www.loom.com/share/2ae30e7b3e914f2a9cf875446f02c1d0,False,"The issue described pertains to the agent's decision-making and navigation process, where it used an incorrect search function and left the site unexpectedly. This is not related to infrastructure but rather to the agent's behavior and logic."
256.0,HITL-Operator-52,Success,Agent managed to unsubscribe to all notifications successfully. ,https://www.loom.com/share/54916f41fbf5427ebdcdccf57ff132bb,False,
264.0,HITL-Operator-53,Success,Agent managed to find a definition and usage of the word onomatopoeia.,https://www.loom.com/share/6e506344b31a49d591eda6fe9267500b,False,
266.0,HITL-Operator-54,Success,"Agent managed to find a multitude of information on Columbia's tuition pricing, and provided a link as well. ",https://www.loom.com/share/fb921d5142914eeb8734f426dbfde0b1,False,
267.0,HITL-Operator-55,Success,Agent identified a plethora of upcoming events listed on the Columbia website.,https://www.loom.com/share/8196ada8a6fb474480e74aa90f8e6e67,False,
269.0,HITL-Operator-56,Success,Agent identified a review include age range for the movie Frozen as well as a key critique.,https://www.loom.com/share/9168436354d74afebaa4eb104eb20cfe,False,
292.0,HITL-Operator-57,Success,Agent was able to identify a stroller in human's area and save it to favorites and confirm. ,https://www.loom.com/share/d0f26c072dd7457c9318af3bd7013aa9,False,
,HITL-Operator-58,Bad Task,Agent was unable to post ad - there was a $5.00 fee associated which it didn't process as well. ,https://www.loom.com/share/14353190781e4d5d8ab17feaf2e06f8d,False,
,HITL-Operator-59,Bad Task,Requires payment?,https://www.loom.com/share/c162dfdfadfd432ea629d658171277da,False,
293.0,HITL-Operator-60,Bad Task,"Craigslist requires log in through link provided to email, which requires agent to leave the website. ",https://www.loom.com/share/f548f7f5513946bd90780908f55fc078,False,
319.0,HITL-Operator-61,Bad Task,"In order to post a new cruncbase company profile, agent needs to attach a social profile to their profile, which has an approval process that may take 1 or more business day.",https://www.loom.com/share/4e851219f1b541c0b3f2fc4ec4cfe9c7,False,
308.0,HITL-Operator-62,Success,Agent was able to identify Los Angeles companies in the e-commerce sector. Agent notably passed CAPTCHA verification without human assistance. ,https://www.loom.com/share/92bc9f263e624e3baf9d0baa9ff530e2,False,
306.0,HITL-Operator-63,Failure,Agent got blocked from accessing crunchbase.,https://www.loom.com/share/e09d1209d3014b00a3bba87b5942efd1,True,"The error indicates that the agent was blocked when trying to access Crunchbase, which is a proxy issue related to the infrastructure and not a problem with the agent itself."
,HITL-Operator-64,Failure,Agent got blocked from accessing crunchbase.,https://www.loom.com/share/efb85b96d684475cb814b7a579b4c65d,False,
299.0,HITL-Operator-65,Failure,Agent got blocked from accessing crunchbase.,https://www.loom.com/share/02ecc12a4a604f75999a8f2a503ba2fc,True,"The error indicates that the AI agent was blocked from accessing the Crunchbase website, which falls under the category of a proxy issue or a website access issue. These are considered infrastructure issues, as they relate to external factors preventing the agent from performing its tasks, rather than a problem with the agent's internal logic or functionality."
332.0,HITL-Operator-66,Success,Agent was able to successfully locate and report the possible language options.,https://www.loom.com/share/449c22aa6baa472cbd696e42a163e550,False,
328.0,HITL-Operator-67,Success,"Agent was able to create the list and delete it, both requiring human approval to do so. ",https://www.loom.com/share/b02c3a4e547e4d15afe52c31f4a3d54b,False,
331.0,HITL-Operator-68,Success,"Agent successfully found and reported an upcoming Crunchyroll event including dates,",https://www.loom.com/share/00b0b0259f204bf38d6de46be226428a,False,
334.0,HITL-Operator-69,Success,"Agent successfully created the playlist, and then added both tv shows to update it.",https://www.loom.com/share/4e1ca68f414b4c81bccc694349c67996,False,
324.0,HITL-Operator-70,Bad Task,"Agent successfully made list and added shows to it. ""Violet Evergarden"" was not available to add, so agent added ""Attack on Titan"" instead.",https://www.loom.com/share/965bbeb2ca474ee79b90a1db02d2ddb6,False,
323.0,HITL-Operator-71,Success,Agent successfully created list with 4 Anime shows that it located.,https://www.loom.com/share/500982124b3648569659f01dba50fa33,False,
341.0,HITL-Operator-72,Failure,"Agent created the list, and then navigated to look up recipes to add. Agent eventually got stuck in a loop of looking for a specific recipe, but switched between tabs incessantly. ",https://www.loom.com/share/031e143e4c40463ea3d33c6f9fb9d44a,False,"The issue described is related to the AI agent's navigation logic. The agent is stuck in a loop while trying to find a specific recipe, indicating a logic or decision-making problem with the agent itself rather than an external infrastructure issue."
,HITL-Operator-73,Bad Task,"Agent returns that it tried to save recipes, but that one needs a subscription to save recipes so it couldn't proceed.",https://www.loom.com/share/1977ddf97b984bf2aee3876603015055,False,
364.0,HITL-Operator-74,Failure,Agent was not able to proceed with mock information within a reasonable time - user could have completed the task much quicker with minimal wait.,https://www.loom.com/share/1db5725203ee4b3cbe476f78abba1179,False,"The issue described relates to the agent's efficiency and speed in processing information, which doesn't fit into the infrastructure issues like login, proxy, captcha, or loading problems. It is more about the internal functioning and optimization of the AI agent itself."
376.0,HITL-Operator-75,Success,"Agent was able to update users address, with much help from human input",https://www.loom.com/share/e2b9b25e9c744b0889bcb842c75ad6cc,False,
375.0,HITL-Operator-76,Success,"Agent was able to add a random shoe, and then up the quantity to 2 in the cart.",https://www.loom.com/share/311482f6e0fd4d8cb60fa14942d836a7,False,
368.0,HITL-Operator-77,Success,Agent was able to add a review and submit with all qualifications outlined in the prompt.,https://www.loom.com/share/6f5fd9e56446493b8261871c22475fa8,False,
378.0,HITL-Operator-78,Failure,Agent was unable to record or download the audio file for the pronounciation of the word. ,https://www.loom.com/share/beb87dbf0a3f4d808d132cb23ce9a87f,False,"The issue pertains to the AI agent's ability to perform a specific task related to audio processing, not an infrastructure problem like login, proxy, or website loading issues."
377.0,HITL-Operator-79,Success,Agent was able to play the audio source and display the phonetic transcription.,https://www.loom.com/share/bb555d03e16b488786aae1166305f5a2,False,
391.0,HITL-Operator-80,Success,Agent was able to navigate to the lead article and return the title.,https://www.loom.com/share/2964071f21e0484baca64e7b16e870c7,False,
397.0,HITL-Operator-81,Success,Agent was able to find an article that mentioned multiple eating destinations.,https://www.loom.com/share/1f941216787e40ee812c2534f8bd9583,False,
403.0,HITL-Operator-82,Success,Agent was able to successfully find and compare the same speaker sold by three different vendors with all qualities required.,https://www.loom.com/share/757118633b2d490e94c3d01363499b1c,False,
412.0,HITL-Operator-83,Success,Agent was able to successfully navigate and find the correct index values as tasked.,https://www.loom.com/share/5245862c0a2f41d7ba984ba73f68f9f4,False,
418.0,HITL-Operator-84,Failure,"Agent timed out - 10 minutes to find a publication was more than enough time to navigate the website, and users would likely search themselves instead of tasking agent. ",https://www.loom.com/share/65565384a21a4e4786284617cdf2256f,False,"The issue described relates to the agent timing out while trying to find a publication, which suggests a problem with the agent's navigation or information retrieval process rather than an infrastructure issue."
417.0,HITL-Operator-85,Success,Agent was able to find three articles that were relevant and pertinent when searching for sustainable fashion.,https://www.loom.com/share/bae3d8c7c9c6430499d438e28d75678f,False,
420.0,HITL-Operator-86,Success,Agent was able to navigate Wikipedia and find a proper explanation for the question posed.,https://www.loom.com/share/b33585301d194478b855cf802bf8662b,False,
421.0,HITL-Operator-87,Success,Agent was able to find the correct number of page views as instructed.,https://www.loom.com/share/49d16910832a45968204d07aa43f68f4,False,
424.0,HITL-Operator-88,Success,Agent was able to find and identify the publisher of the page on climate change.,https://www.loom.com/share/cb915cc84f2247e4910d34b66f7b1b7a,False,
